Sheet: Attributes
C1: 1
A2: Name | B2: Class | C2: Level | D2: Background | E2: Race | F2: Alignment
A4: Strength | C4: of:=CEILING([.C1]/4+1) -> 2 | D4: Proficiency
A5: of:=FLOOR(([.A6]-10)/2) -> 1
A6: 13 | C6: 0 | D6: of:=IF([.C6]=0; [.$A$5]; [.$A$5]+[.$C$4]) -> 1 | E6: of:=[.A4] -> Strength
A7: Dexterity | C7: 0 | D7: of:=IF([.C7]=0; [.$A$8]; [.$A$8]+[.$C$4]) -> 1 | E7: of:=[.A7] -> Dexterity
A8: of:=FLOOR(([.A9]-10)/2) -> 1 | C8: 0 | D8: of:=IF([.C8]=0; [.$A$11]; [.$A$11]+[.$C$4]) -> 1 | E8: of:=[.A10] -> Constitution
A9: 13 | C9: 0 | D9: of:=IF([.C9]=0; [.$A$14]; [.$A$14]+[.$C$4]) -> 1 | E9: of:=[.A13] -> Intelligence
A10: Constitution | C10: 0 | D10: of:=IF([.C10]=0; [.$A$17]; [.$A$17]+[.$C$4]) -> 1 | E10: of:=[.A16] -> Wisdom
A11: of:=FLOOR(([.A12]-10)/2) -> 1 | C11: 0 | D11: of:=IF([.C11]=0; [.$A$20]; [.$A$20]+[.$C$4]) -> 1 | E11: of:=[.A19] -> Charisma
A12: 13 | C12: Saving Throws
A13: Intelligence
A14: of:=FLOOR(([.A15]-10)/2) -> 1 | C14: 0 | D14: of:=IF([.C14]=0; [.$A$8]; [.$A$8]+[.$C$4]) -> 1 | E14: Acrobatics | F14: (Dex)
A15: 12 | C15: 0 | D15: of:=IF([.C15]=0; [.$A$17]; [.$A$17]+[.$C$4]) -> 1 | E15: Animal Handling | F15: (Wis)
A16: Wisdom | C16: 0 | D16: of:=IF([.C16]=0; [.$A$14]; [.$A$14]+[.$C$4]) -> 1 | E16: Arcana | F16: (Int)
A17: of:=FLOOR(([.A18]-10)/2) -> 1 | C17: 0 | D17: of:=IF([.C17]=0; [.$A$5]; [.$A$5]+[.$C$4]) -> 1 | E17: Athletics | F17: (Str)
A18: 12 | C18: 0 | D18: of:=IF([.C18]=0; [.$A$20]; [.$A$20]+[.$C$4]) -> 1 | E18: Deception | F18: (Cha)
A19: Charisma | C19: 0 | D19: of:=IF([.C19]=0; [.$A$14]; [.$A$14]+[.$C$4]) -> 1 | E19: History | F19: (Int)
A20: of:=FLOOR(([.A21]-10)/2) -> 1 | C20: 0 | D20: of:=IF([.C20]=0; [.$A$17]; [.$A$17]+[.$C$4]) -> 1 | E20: Insight | F20: (Wis)
A21: 12 | C21: 0 | D21: of:=IF([.C21]=0; [.$A$20]; [.$A$20]+[.$C$4]) -> 1 | E21: Intimidation | F21: (Cha)
C22: 0 | D22: of:=IF([.C22]=0; [.$A$14]; [.$A$14]+[.$C$4]) -> 1 | E22: Investigation | F22: (Int)
A23: Perception | C23: 0 | D23: of:=IF([.C23]=0; [.$A$17]; [.$A$17]+[.$C$4]) -> 1 | E23: Medicine | F23: (Wis)
A24: of:=10+[.A17] -> 11 | C24: 0 | D24: of:=IF([.C24]=0; [.$A$14]; [.$A$14]+[.$C$4]) -> 1 | E24: Nature | F24: (Int)
C25: 0 | D25: of:=IF([.C25]=0; [.$A$17]; [.$A$17]+[.$C$4]) -> 1 | E25: Perception | F25: (Wis)
C26: 0 | D26: of:=IF([.C26]=0; [.$A$20]; [.$A$20]+[.$C$4]) -> 1 | E26: Performance | F26: (Cha)
C27: 0 | D27: of:=IF([.C27]=0; [.$A$20]; [.$A$20]+[.$C$4]) -> 1 | E27: Persuasion | F27: (Cha)
C28: 0 | D28: of:=IF([.C28]=0; [.$A$14]; [.$A$14]+[.$C$4]) -> 1 | E28: Religion | F28: (Int)
C29: 0 | D29: of:=IF([.C29]=0; [.$A$8]; [.$A$8]+[.$C$4]) -> 1 | E29: Sleight of Hand | F29: (Dex)
C30: 0 | D30: of:=IF([.C30]=0; [.$A$8]; [.$A$8]+[.$C$4]) -> 1 | E30: Stealth | F30: (Dex)
C31: 0 | D31: of:=IF([.C31]=0; [.$A$17]; [.$A$17]+[.$C$4]) -> 1 | E31: Survival | F31: (Wis)
C32: Skills